{"id":"job_Cc2Cc2Cc2Cc2Cc2Cc2","session_id":"ses_Aa0Aa0Aa0Aa0Aa0Aa0","source_id":"src_Bb1Bb1Bb1Bb1Bb1Bb1","state":"COMPLETED","progress":{"mode":"determinate","stage":"done","percent":100,"elapsed_ms":21000},"error":null,"result":{"candidate_count":0,"incident_ids":[],"analyzed_interval":{"start_ms":0,"end_ms":45000}},"config_hash":"bbbbbbbbbbbbbbbbbbbbbbbbbbbbbbbbbbbbbbbbbbbbbbbbbbbbbbbbbbbbbbbb","revision":5,"created_at":"2026-10-19T15:00:01Z","updated_at":"2026-10-19T15:00:22Z"}
